id,conversation_id,date,tweet,hashtags,user_id_str,username,name,link,urls,photos,nlikes,nreplies,nretweets,search,reply_to,score,date-day
1464019584390938632,1464007559115948036,2021-11-26 00:54:03,@KawiorPrawicy Odrazający jest ten zawodowy Żydek,[],1438894695053209602,DziadzioRoza,Dziadek Róża,https://twitter.com/DziadzioRoza/status/1464019584390938632,[],[],2,2,0,Żydek,"[{'screen_name': 'KawiorPrawicy', 'name': 'Kawiorowa Prawica', 'id': '738840283102773248'}]",4,2021-11-26
1470993106694721536,1470993106694721536,2021-12-15 06:44:21,"@MorawieckiM zydek zrobil Polakow w wielkiego Wała, najwieksza podwyzka podatkow od ostatnich 100 lat w okresie najwiekszego sztucznie wywolanego kryzysu.  Zniszczyl male i srednie biznesy, reszte dobic podatkami, a rynek przygotowac pod przejecie przez korporacje. Zydku good!",[],1391898075522867202,Henryk47151982,Henryk,https://twitter.com/Henryk47151982/status/1470993106694721536,[],[],2,0,1,Żydek,[],3,2021-12-15
1474406065970323518,1474372375642841092,2021-12-24 16:46:13,"@Ciekaw0stki @Matt30491354 @KONFEDERACJA_ Nie można się dziwić, skoro mają takich znajomych, zresztą ten żydek to również znajomy Rydzyka  https://t.co/fgELKaykuI",[],873939830857773058,Bartek92898106,Bartek​,https://twitter.com/Bartek92898106/status/1474406065970323518,[],"['https://pbs.twimg.com/media/FHYkgB6XwAIbraZ.jpg', 'https://pbs.twimg.com/media/FHYkgOVXoBUZYrz.jpg']",3,0,0,Żydek,"[{'screen_name': 'Ciekaw0stki', 'name': 'Ciekawostki i czasem polityka', 'id': '712209050054873089'}, {'screen_name': 'Matt30491354', 'name': 'Jordan Belfort', 'id': '1375577857724911617'}, {'screen_name': 'KONFEDERACJA_', 'name': 'Konfederacja', 'id': '1093510047605374976'}]",3,2021-12-24
1466433278043435019,1466411879551668237,2021-12-02 16:45:13,@Tysol A żydek by się przejmował tym że Polską młodzież by zaatakowali.,[],1348706617987104768,AWilk321,anna wilk321,https://twitter.com/AWilk321/status/1466433278043435019,[],[],2,1,0,Żydek,"[{'screen_name': 'Tysol', 'name': 'Tygodnik Solidarność', 'id': '108609273'}]",3,2021-12-02
1476912051415138304,1476911697310982146,2021-12-31 14:44:07,@olimpia_szuwar Chyba będą spierdalac 😁,[],1427714592722104322,PasoZydek,Paweł,https://twitter.com/PasoZydek/status/1476912051415138304,[],[],2,1,0,Żydek,"[{'screen_name': 'olimpia_szuwar', 'name': 'Olimpia Szuwar', 'id': '820209598250553344'}]",3,2021-12-31
1472552256885116930,1472475702310154240,2021-12-19 13:59:51,@skkf_net „Nigdy nie włożyłem i nie włożę w kobietę Gdybym nie był żydem kurwo miałbym gówno za napletem”  Hetero to zero,[],1351355166151335936,yoshimayo1,yoshimayo,https://twitter.com/yoshimayo1/status/1472552256885116930,[],[],549,1,11,Żydem,"[{'screen_name': 'skkf_net', 'name': 'skkf', 'id': '97096809'}]",561,2021-12-19
1474778195748700161,1474778195748700161,2021-12-25 17:24:56,"Jesteś Żydem? Jesteś Murzynem? Jesteś gejem? Jesteś zaszczepiony? Jesteś niezaszczepiony? Jesteś transem? Jesteś lesbijką? Jesteś rudy?  Kompletnie mnie nie interesuje kim jesteś. Dla mnie jesteś człowiekiem.   No chyba, że jesteś socjalistą albo komunistą. Tu mamy problem.",[],1250804435275710465,Ankapitalizm,Anarchokapitalizm,https://twitter.com/Ankapitalizm/status/1474778195748700161,[],[],389,13,25,Żydem,[],427,2021-12-25
1479767296193314817,1479767296193314817,2022-01-08 11:49:50,"Tylko w waszych NIENAWISTNYCH umysłach Kasiu @Jewish_pl Ojciec Kolbe był ""antysemitą"" ! 13 letni Sigmunt Gerson o Św.M.M Kolbe : ""Był dla mnie jak Anioł.Wiedział,że byłem Żydem.On kochał każdego.Rozdawał miłość i tylko miłość.Będę go zawsze kochał do ostatnich chwil mojego życia""  https://t.co/9QNCU7QDsa",[],3816885381,AnitaSchelde,Kasjopea,https://twitter.com/AnitaSchelde/status/1479767296193314817,[],['https://pbs.twimg.com/media/FIkwbA2XwAU_rhc.jpg'],280,7,112,Żydem,[],399,2022-01-08
1477657400958193675,1477657400958193675,2022-01-02 16:05:52,"Byłem lewackim śmieciem, pierdolonym komunistą, ale dzisiaj bomba. Jestem Żydem.  https://t.co/rySCCB4xKj",[],1071108313109151745,tw_wolfgang,Paweł Jędrzejek,https://twitter.com/tw_wolfgang/status/1477657400958193675,[],['https://pbs.twimg.com/media/FIGxkgoXwAESeQc.jpg'],233,71,17,Żydem,[],321,2022-01-02
1463552919488417798,1463552919488417798,2021-11-24 17:59:42,"Niniejszym Bolesław #Piecha zapisał się do grupy faszystów sanitarnych. Proponuje wykluczenia dla niezaszczepionych, lockdowny, sprawdzenie paszportów czyli pokaż, że nie jesteś współczesnym żydem. To jest k. dramat skąd tylu durnych lekarzy na świecie? Czekam na #Norymberga2.  https://t.co/bZwMy30zLo","['piecha', 'norymberga2']",2976477196,Bob_Gedron,Bob Gedron 💯 🇵🇱,https://twitter.com/Bob_Gedron/status/1463552919488417798,[],['https://pbs.twimg.com/media/FE-USUmXwAk6rsk.jpg'],165,18,46,Żydem,[],229,2021-11-24
1474089078282932229,1474089078282932229,2021-12-23 19:46:38,"Nie ma afery, bo te podsłuchy wykryło laboratorium, które jest finansowane przez pierdyliard organizacji i jedna z nich jest powiązana z wszechmocnym ŻYDEM SOROSEM.  Proszę się rozejść.",[],1313873922501246977,KorolukM,Koroluk,https://twitter.com/KorolukM/status/1474089078282932229,[],[],201,2,9,Żydem,[],212,2021-12-23
1468702311258202120,1468702311258202120,2021-12-08 23:01:32,"Wszystko mi jedno, czy ktoś jest Tatarem, Cyganem, Żydem czy Eskimosem. Jest tak samo dobrym Polakiem, co ten, który może udowodnić swoje pochodzenie od Piasta Kołodzieja.  Jeśli jest polskim patriotą.",[],1202288292680683521,JacekMilewski2,Jacek Milewski,https://twitter.com/JacekMilewski2/status/1468702311258202120,[],[],158,21,24,Żydem,[],203,2021-12-08
1465299908190035979,1465299908190035979,2021-11-29 13:41:36,"Po co w Polsce obchodzić Chanuka, gdy nie jest się Żydem? Ramadan też obchodzicie?",[],86394645,galopujacymajor,Gamuel,https://twitter.com/galopujacymajor/status/1465299908190035979,[],[],134,57,5,Żydem,[],196,2021-11-29
1467774991857029121,1467746916700200963,2021-12-06 09:36:42,@LukaszKohut Jej! Nie podobają ci się Niemcy lat 30'XX wieku a jesteś Żydem? To wyjedz!  Serio! Czy Pan jest normalny?!,[],1052980960076189697,Helena91986129,Helenka🇵🇱,https://twitter.com/Helena91986129/status/1467774991857029121,[],[],112,0,3,Żydem,"[{'screen_name': 'LukaszKohut', 'name': 'Łukasz Kohut 🇪🇺', 'id': '426773410'}]",115,2021-12-06
1469003840091533313,1469003840091533313,2021-12-09 18:59:42,"Bijecie chochoła z wyobrażeń o ludziach bez weryfikacji. Zdradzę ci sekret pssst. Polscy katolicy wiedzą, że Maryja była Żydówką. Wiedzą też, że Jezus był Żydem.  Irańczycy nie znoszą Arabów, ale też nie przeszkadza im to czcić Mahometa. Wiedzą jakiej narodowości był.",[],1269192517968367623,PKpopiara,⏚ Prawacka kpopiara ✝ 🇵🇱 🇻🇦💙,https://twitter.com/PKpopiara/status/1469003840091533313,[],[],102,2,3,Żydem,[],107,2021-12-09
1468984963085316096,1468984963085316096,2021-12-09 17:44:42,"Zrekonstruowano prącie Jezusa. Według danych pochodzących z najnowszych technik naukowych mógł wcale nie być Żydem. ""Z napletka Jezusa bije polskość."" mówią kościelni eksperci. #wieszwięcej",['wieszwięcej'],323673294,TheGreatBoro,Wielki Boro,https://twitter.com/TheGreatBoro/status/1468984963085316096,[],[],85,4,8,Żydem,[],97,2021-12-09
1464010126944256001,1464010126944256001,2021-11-26 00:16:28,"Twój Bóg jest Żydem Twoja muzyka jest czarna Twój samochód jest japoński Twoja pizza jest włoska Twój gaz jest algierski, Twoja kawa jest brazylijska  Twoja demokracja jest grecka Twoje cyfry są arabskie Twoje litery są łacińskie Jestem twoim sąsiadem. I nadal nazywasz mnie obcym",[],2873986428,JStanislawska,Joanna Cavarretta 🇵🇸 #StopTorturomNaGranicy,https://twitter.com/JStanislawska/status/1464010126944256001,[],[],70,2,15,Żydem,[],87,2021-11-26
1467121133812170764,1467121133812170764,2021-12-04 14:18:30,Co 5 miesięcy masz sobie wstrzyknąć mRNA bo inaczej zostajesz żydem niezaszczepionym i represje,[],47074030,lecterro,lecterro,https://twitter.com/lecterro/status/1467121133812170764,[],[],51,5,11,Żydem,[],67,2021-12-04
1468187335443558401,1468187335443558401,2021-12-07 12:55:13,"Czy jeśli jestem Żydem, a mój kolega sam nie jest antysemitą, ale koleguje się z antysemitami albo głosuje na antysemitów to czy w ogóle jest moim kolegą? Uważam, że nie jest. Dotyczy także oczywiście homofobów, mizoginów, transfobów, rasistów, faszystów i innych szkodników.",[],3073313399,AhmedGoldstein,Ahmed Goldstein,https://twitter.com/AhmedGoldstein/status/1468187335443558401,[],[],61,1,4,Żydem,[],66,2021-12-07
1479078434760544256,1478855585219194880,2022-01-06 14:12:33,@JoannaSobczyk6 @sikorskiradek @donaldtusk dobrze że Chrystus nie był Żydem tylko Polakiem z podkarpacia a jego Matka była z Częstochowy.,[],1346868920020570112,krioadi,Adi,https://twitter.com/krioadi/status/1479078434760544256,[],[],55,1,1,Żydem,"[{'screen_name': 'JoannaSobczyk6', 'name': 'Joanna Sobczyk', 'id': '899182335144468480'}, {'screen_name': 'sikorskiradek', 'name': 'Radosław Sikorski MEP 🇵🇱🇪🇺', 'id': '117029568'}, {'screen_name': 'donaldtusk', 'name': 'Donald Tusk', 'id': '375146901'}]",57,2022-01-06
1475016278578548738,1475016278578548738,2021-12-26 09:10:59,"Dziś wspominamy św. Szczepana, diakona i pierwszego męczennika. Najprawdopodobniej był zhellenizowanym Żydem. Został wybrany przez Apostołów jako jeden z siedmiu pierwszych diakonów w Jerozolimie. Za głoszenie Ewangelii został oskarżony przez Sanhedryn i ukamienowany ok. 36 r.  https://t.co/3bqAkwbSJu",[],1064998476138889217,Iaquobus,Iacobus ن,https://twitter.com/Iaquobus/status/1475016278578548738,[],['https://pbs.twimg.com/media/FHhPe4vXoAQmiwS.jpg'],36,0,15,Żydem,[],51,2021-12-26
1471520182245883905,1471518117910093833,2021-12-16 17:38:45,"@Joanna_Czarna Trzeba mówić, że jest się Żydem. Wszystkie bramy stoją otworem.",[],2567728560,WojciechSL,WojciechPL 🇵🇱🇵🇱🇵🇱,https://twitter.com/WojciechSL/status/1471520182245883905,[],[],46,3,1,Żydem,"[{'screen_name': 'Joanna_Czarna', 'name': 'Joanna Czarna', 'id': '3397086629'}]",50,2021-12-16
1465478308393627648,1465452150360842242,2021-11-30 01:30:30,@RobertWinnicki A Jezus nie był Żydem?,[],1151820757514838016,Klaudia__29,Klaudia O.,https://twitter.com/Klaudia__29/status/1465478308393627648,[],[],41,7,0,Żydem,"[{'screen_name': 'RobertWinnicki', 'name': 'Robert Winnicki', 'id': '289210875'}]",48,2021-11-30
1471550925454168070,1471550925454168070,2021-12-16 19:40:55,"Zabójca prezydenta Narutowicza, Eligiusz Niewiadomski, był chory psychicznie. Wybitny psychiatra Maurycy Urstein napisał broszurę nt. niepoczytalności Niewiadomskiego, a wydany na niego wyrok śmierci nazwał zbrodnią sądową. Urstein był Żydem.",[],864516245063946241,katarzyna_ts,Katarzyna Treter-Sierpińska,https://twitter.com/katarzyna_ts/status/1471550925454168070,[],[],38,2,6,Żydem,[],46,2021-12-16
1467394929739640835,1467189414677856264,2021-12-05 08:26:28,@ABNPoland Typowy polski antysemityzm. Sami nie sprofanują tylko Żydem się wyręczają.,[],1183429736321736704,monika03465495,Monika,https://twitter.com/monika03465495/status/1467394929739640835,[],[],39,0,5,Żydem,"[{'screen_name': 'ABNPoland', 'name': 'Agencja Bezpieczeństwa Narodowego', 'id': '1374046745844416513'}]",44,2021-12-05
1473267801645363204,1473265342822682625,2021-12-21 13:23:10,"w sumie nie pierwszy raz, pamiętacie jak zostałem naziolem, bo napisałem typowi „zrób fikołka”, a on mi napisał, że go odczłowieczam bo jest żydem",[],946371710139424768,tmrz_,tmrz,https://twitter.com/tmrz_/status/1473267801645363204,[],[],41,2,1,Żydem,[],44,2021-12-21
1464728070175264783,1464210073866153988,2021-11-27 23:49:19,"@Gasiuk_Pihowicz Ponieważ dalej się Pani tutaj pląta nie zważając na uwagi,powinna Pani poznać prawdę: Geremek był Żydem wrogo nastawionym do Polaków, a misją jego, Michnika i paru innych był miraż stworzenia z Polski awaryjnej wersji Izraela na wypadek gdyby US zdjęło parasol ochronny ich nie ma",[],1125736519317229568,Zagoba3,Zagłoba,https://twitter.com/Zagoba3/status/1464728070175264783,[],[],36,1,6,Żydem,"[{'screen_name': 'Gasiuk_Pihowicz', 'name': 'Kamila Gasiuk-Pihowicz', 'id': '3401329131'}]",43,2021-11-27
1465005142885941250,1465005142885941250,2021-11-28 18:10:19,"Hitlerowcy mawiali, że o tym kto jest Żydem decydują oni. Jak widać, Do Rzeszy kieruje się podobnym sposobem myślenia we wskazywaniu Polaków. Haniebna okładka.  https://t.co/OmdH41pb7i",[],1332273297149587456,szymonlasiewicz,Szymon Lasiewicz #PPS 🚩,https://twitter.com/szymonlasiewicz/status/1465005142885941250,[],['https://pbs.twimg.com/media/FFS-acNX0Ag84OP.jpg'],31,3,6,Żydem,[],40,2021-11-28
1465058513730867200,1465058513730867200,2021-11-28 21:42:23,Czy warto być Żydem.,[],1203062944617107456,YrakiwYnolapan,Dr. Krystian Kleist 🇩🇪 🇵🇱,https://twitter.com/YrakiwYnolapan/status/1465058513730867200,[],[],20,18,1,Żydem,[],39,2021-11-28
1481521772986048517,1481521772986048517,2022-01-13 08:01:30,"Jestem Żydem, masonem i ajwaj",[],1290179037852315648,piec_mieczy,🗡🗡🗡🗡🗡,https://twitter.com/piec_mieczy/status/1481521772986048517,[],[],34,4,0,Żydem,[],38,2022-01-13
1465484729742995459,1465452150360842242,2021-11-30 01:56:01,"@RobertWinnicki Z tymi milionami to nie przesadzałabym, ani w kwestii adwentu ani tym bardziej rorat. Adwent był, jest i będzie,ale jakoś specjalnej celebracji nie widać, tak samo jak tłumów na roratach. Poza tym Chanuka jest zupełnie czymś innym niż adwent. ps. Pan Jezus też był Żydem.",[],1382644366313934850,Lea_Szulman1943,Lea,https://twitter.com/Lea_Szulman1943/status/1465484729742995459,[],[],36,1,1,Żydem,"[{'screen_name': 'RobertWinnicki', 'name': 'Robert Winnicki', 'id': '289210875'}]",38,2021-11-30
1473276030228082688,1473276030228082688,2021-12-21 13:55:52,"#Sawka: - O tym, kto jest Żydem, decyduję ja - oświadczył swego czasu wszechwładny Hermann Goering. Decydował. -   Mamy w Polsce wolność słowa - twierdzą PiS-owcy. Mają.   Przekonał się o tym dziennikarz #TOKFM @maslak_piotr .   https://t.co/p7aaTF9csa","['sawka', 'tokfm']",4044862769,Bart_Wielinski,Bartosz T. Wieliński 🇵🇱💯,https://twitter.com/Bart_Wielinski/status/1473276030228082688,"['https://wyborcza.pl/7,75968,27936200.html']",[],27,1,7,Żydem,[],35,2021-12-21
1467577225331580929,1467577225331580929,2021-12-05 20:30:51,"Polecam obejrzeć ten wywiad. Facet przez cały wywiad próbuje wmówić Żydówce, że Polacy ją źle traktują i są do niej negatywnie nastawienie, a ona co chwilę go gasi mówiąc, że to margines, który dotknął ją raz w życiu i Polska to kraj zajebisty do życia kiedy jesteś żydem xDD 👇",[],890927120171642880,Saint_Lagoda,V e r e n a,https://twitter.com/Saint_Lagoda/status/1467577225331580929,[],[],29,3,2,Żydem,[],34,2021-12-05
1468314716024016906,1468252464965201923,2021-12-07 21:21:22,"@ZandbergRAZEM Ale wiesz, że zdaniem Sądu Najwyższego można prowadzić samochód bez prawa jazdy? Co prawda trzeba być żydem jak Najsztub, ale to chyba akurat ci nie przeszkadza.",[],3313133907,Prokurent74,Prokurent,https://twitter.com/Prokurent74/status/1468314716024016906,[],[],25,2,6,Żydem,"[{'screen_name': 'ZandbergRAZEM', 'name': 'Adrian Zandberg', 'id': '4008009335'}]",33,2021-12-07
1464269316820455433,1464210073866153988,2021-11-26 17:26:24,"@Gasiuk_Pihowicz To ten stary kurwiarz, co zginął w czasie uprawiania seksu oralnego z prostytutka? Jak prowadził samochód? Poza tym BERELE LEWARTOW, a nie Bronek Geremek. Nic dziwnego, że zmienił nazwisko, bo być Żydem to po prostu, kurwa, co najmniej obciach.",[],2929263465,smbarja,kobee.s,https://twitter.com/smbarja/status/1464269316820455433,[],[],27,0,5,Żydem,"[{'screen_name': 'Gasiuk_Pihowicz', 'name': 'Kamila Gasiuk-Pihowicz', 'id': '3401329131'}]",32,2021-11-26
1463859200845565956,1463859200845565956,2021-11-25 14:16:45,Jak zostać żydem?,[],1277362388145143808,LewakCzarodziej,"Kurwa, jest w pyte 🥴",https://twitter.com/LewakCzarodziej/status/1463859200845565956,[],[],16,15,1,Żydem,[],32,2021-11-25
1466155142215090185,1466155142215090185,2021-12-01 22:20:00,Czy Szczerba jest Żydem?!,[],1197937694472585216,WolnaRadio,Olga Srokarczuk,https://twitter.com/WolnaRadio/status/1466155142215090185,[],[],12,13,4,Żydem,[],29,2021-12-01
1465303753259687940,1465303753259687940,2021-11-29 13:56:53,Ej serio ktoś niebędący żydem obchodzi Chanuke? xDDDDD,[],761969035655380992,trujacekwiaty,Jacek Bębniarz,https://twitter.com/trujacekwiaty/status/1465303753259687940,[],[],22,5,1,Żydem,[],28,2021-11-29
1465558504660471809,1465452150360842242,2021-11-30 06:49:10,"@RobertWinnicki Ale wiesz, że Jezus był Żydem? Oni wszyscy byli.",[],254521569,jacek_liberski,Jacek Liberski 🇵🇱🇪🇺🇺🇸🏳️‍🌈,https://twitter.com/jacek_liberski/status/1465558504660471809,[],[],24,2,0,Żydem,"[{'screen_name': 'RobertWinnicki', 'name': 'Robert Winnicki', 'id': '289210875'}]",26,2021-11-30
1481358672806694915,1481358672806694915,2022-01-12 21:13:24,Czy Obajtek jest Żydem?,[],1171102926519099392,2Xbobo,Bobo 🇵🇱💯❤️ 💞,https://twitter.com/2Xbobo/status/1481358672806694915,[],[],9,9,8,Żydem,[],26,2022-01-12
1478777424062164992,1478777424062164992,2022-01-05 18:16:26,"Serio bycie Żydem jest według ludzi przywilejem??? XDDDDDD Czy oni wiedzą, co się działo podczas 2 wojny światowej",[],769247856767143936,HerbatkaLipton,۞ Rusałka Jaskra ۞ Loki dreams,https://twitter.com/HerbatkaLipton/status/1478777424062164992,[],[],23,2,0,Żydem,[],25,2022-01-05
1472595632477065220,1472583279274512386,2021-12-19 16:52:12,"@R_A_Ziemkiewicz Bardziej pańszczyźnianego. Każdy musi mieć swojego chama, na tle którego jest paniskiem. Klasycznym przykładem jest tu Michnik ze swoją dziecinną potrzebą bycia intelektualnym przewodnikiem, ekscentrykiem i kapryśnym geniuszem, który sam decyduje o tym ""kto jest Żydem""",[],1022013289918812160,RLabuznik,Robert Labużnik 🎥,https://twitter.com/RLabuznik/status/1472595632477065220,[],[],24,0,0,Żydem,"[{'screen_name': 'R_A_Ziemkiewicz', 'name': 'Rafał A. Ziemkiewicz', 'id': '1388943902'}]",24,2021-12-19
1480954386469773313,1480912009243860993,2022-01-11 18:26:55,"@KorolukM Also: bycie Żydem jako coś dyskwalifikującego, a potem powtarzaj: w Polsce nie ma i nie bylo antysemityzmu",[],1413908563,nuclearntp,nietoperz rzymski #StartSegregacjiSanitarnej,https://twitter.com/nuclearntp/status/1480954386469773313,[],[],23,1,0,Żydem,"[{'screen_name': 'KorolukM', 'name': 'Koroluk', 'id': '1313873922501246977'}]",24,2022-01-11
1468939360372465671,1468939360372465671,2021-12-09 14:43:29,"""Kto z Żydami spółkuje ten na krzyżu ląduje""! ⚠️ Fakty historyczne są takie, że Judasz Iskariota był Żydem. To on zdradził Chrystusa, sprzedał Go za 30 srebrników i wydał na śmierć.⚠️ OBUDŹ SIĘ POLSKO PÓKI MASZ JESZCZE MOŻLIWOŚĆ 💪🇵🇱💪🇵🇱💪🇵🇱💪  https://t.co/6dg99XCSFe",[],1336559411943399424,anonymous_mg76,ANONYMOUS MG76,https://twitter.com/anonymous_mg76/status/1468939360372465671,[],"['https://pbs.twimg.com/media/FGK4jofXIAANNc0.jpg', 'https://pbs.twimg.com/media/FGK4kAxXsAEZtIR.jpg']",17,3,3,Żydem,[],23,2021-12-09
1468988595222597634,1468966993248223240,2021-12-09 17:59:08,"@trzaskowski_ @warszawa Rafałku wyjaśnij mi jak można być żołnierzem AK, Żydem i zarazem germanofilem nagradzanym przez swoich oprawców? Nie kłuci ci się to wszystko ze sobą?😉",[],1211907609738928129,KrzysztofZK,Krzysztof,https://twitter.com/KrzysztofZK/status/1468988595222597634,[],[],14,3,5,Żydem,"[{'screen_name': 'trzaskowski_', 'name': 'Rafał Trzaskowski', 'id': '370112160'}, {'screen_name': 'warszawa', 'name': 'Warszawa', 'id': '199290168'}]",22,2021-12-09
1471758939184418818,1471747071321546756,2021-12-17 09:27:29,@Leszek_6 Proszę napisać ze jego dziadek był Żydem który w czasie holokaustu donosił na Polaków,[],1413062790189813762,Karol52580331,Karol,https://twitter.com/Karol52580331/status/1471758939184418818,[],[],21,1,0,Żydem,"[{'screen_name': 'Leszek_6', 'name': 'Beata Szydło była premier RP parodia', 'id': '1443285810367844352'}]",22,2021-12-17
1480560870954614786,1480544236240097283,2022-01-10 16:23:13,"@Aga_pioro @Svaarth To właściwie dziecko. Od 2 lat media piorą mózgi 24h na dobę, codziennie straszy się, że jak się nie zaszczepisz to zostaniesz żydem XXI wieku, machina propagandy walcuje nas nonstop i dziewczyna się złamała. Może ma rodziców covidiotów, trudno powiedzieć, ale szkoda jej :(",[],1431491179678470144,Malvineaa,Melly,https://twitter.com/Malvineaa/status/1480560870954614786,[],[],19,3,0,Żydem,"[{'screen_name': 'Aga_pioro', 'name': 'Pszczoła 🇵🇱🏴\U000e0067\U000e0062\U000e0073\U000e0063\U000e0074\U000e007f🇬🇧🇮🇪🇬🇷🇷🇺', 'id': '1473626100626513925'}, {'screen_name': 'Svaarth', 'name': 'Svarth', 'id': '3165179619'}]",22,2022-01-10
1465553109061619713,1465452150360842242,2021-11-30 06:27:44,@RobertWinnicki Jezus był czarnym Żydem z Afryki. Chyba że wasz był biały z Polski? Zdementuj albo zamilcz.,[],1217878254742315010,SebastianM54_,SebastianM54,https://twitter.com/SebastianM54_/status/1465553109061619713,[],[],19,2,0,Żydem,"[{'screen_name': 'RobertWinnicki', 'name': 'Robert Winnicki', 'id': '289210875'}]",21,2021-11-30
1464341376720687109,1464341376720687109,2021-11-26 22:12:45,Jestem Żydem Wszyscy na kolana ‼️  https://t.co/PUiRBDYUQQ,[],440739954,grzegorz355,Gregor355 🏴‍☠️🏴󠁧󠁢󠁳󠁣󠁴󠁿☀️🙋‍♂️,https://twitter.com/grzegorz355/status/1464341376720687109,['https://twitter.com/GregParis75017/status/1464334737217134602?s=20'],[],16,3,2,Żydem,[],21,2021-11-26
1466648006078435333,1466648006078435333,2021-12-03 06:58:28,"Czyli co? Duda oszukał Polaków jest żydem, a katolikiem był i jest na potrzeby zwodzenia Polaków.",[],1315190509342728192,Feliks95417446,Krzysztof Polska,https://twitter.com/Feliks95417446/status/1466648006078435333,[],[],17,2,2,Żydem,[],21,2021-12-03
1471385921392189444,1471385921392189444,2021-12-16 08:45:15,Jaka jest różnica między żydem a św mikołajem?  Mikołaj schodzi w dół po kominie,[],1250733417395826688,WWWWEEEEQQQQUUU,weeq,https://twitter.com/WWWWEEEEQQQQUUU/status/1471385921392189444,[],[],17,4,0,Żydem,[],21,2021-12-16
1471023318719508486,1471017683990761472,2021-12-15 08:44:24,@BajkowaBogusia Dobry Adwokat i założyć sprawę za dyskryminacjie. W tym monecie podważają Konstytucyjne prawo do wolności.  I jeszcze napisać że jest się Żydem . Wtedy bracia Żydowscy poczują GESZEFT. I CCC się Qrwa nie wypłaci za Antysemityzm.,[],1149576767478235136,Daniel51421132,Daniel 🇵🇱,https://twitter.com/Daniel51421132/status/1471023318719508486,[],[],14,1,5,Żydem,"[{'screen_name': 'BajkowaBogusia', 'name': 'Bogna', 'id': '4340042909'}]",20,2021-12-15
1473970067125776386,1473727322536783880,2021-12-23 11:53:43,"@KrzysztofGrzeg7 @SzaryObywatel7 @PolandnotPolin @katarzyna_ts @a_niedzielski @basiukiewiczpaw @MorawieckiM Mało kto wie, a nikt nie pyta o to czy ta gnida Morawiecki ma izraelskie obywatelstwo. Dziwi mnie to od kiedy tu podawałem w 2017r., że ten izraelski szpion jest żydem i ma obywatelstwo izraelskie. Polacy to jednak owce.  https://t.co/hD1FfH2Ulm",[],3260898400,SimonTemplarTS,The Saint,https://twitter.com/SimonTemplarTS/status/1473970067125776386,[],['https://pbs.twimg.com/media/FHSX0wyX0AMIv28.png'],11,1,8,Żydem,"[{'screen_name': 'KrzysztofGrzeg7', 'name': 'Krzysztof Grzegorz', 'id': '924757898839851009'}, {'screen_name': 'SzaryObywatel7', 'name': 'Szary Obywatel', 'id': '1441674546352820225'}, {'screen_name': 'PolandnotPolin', 'name': 'POLAND NOT POLIN', 'id': '1133428436242960386'}, {'screen_name': 'katarzyna_ts', 'name': 'Katarzyna Treter-Sierpińska', 'id': '864516245063946241'}, {'screen_name': 'a_niedzielski', 'name': 'Adam Niedzielski', 'id': '1377800274'}, {'screen_name': 'basiukiewiczpaw', 'name': 'basiukiewiczpaw', 'id': '1451622005137158149'}, {'screen_name': 'MorawieckiM', 'name': 'Mateusz Morawiecki', 'id': '939053934232195072'}]",20,2021-12-23
1464335433383436305,1464334737217134602,2021-11-26 21:49:08,"@GregParis75017 @KONFEDERACJA_ @pisorgpl Jezus Chrystus był Polakiem 😃 Tylko niewierni mówią, że był żydem 😂",[],1442043051682107403,DlaKuba,Kuba ***** PiS,https://twitter.com/DlaKuba/status/1464335433383436305,[],[],15,4,0,Żydem,"[{'screen_name': 'GregParis75017', 'name': 'Grzegorz 🇵🇱 ✌️ Mr. Greg 🇫🇷 ✌️', 'id': '1160270269'}, {'screen_name': 'KONFEDERACJA_', 'name': 'Konfederacja', 'id': '1093510047605374976'}, {'screen_name': 'pisorgpl', 'name': 'Prawo i Sprawiedliwość', 'id': '15877628'}]",19,2021-11-26
1474654380146282498,1474382351698378753,2021-12-25 09:12:56,"@Piotr_Drac Ale jebiesz gościu na temat karpia, na przykład.  Hodowany na ziemiach polskich od XIII w. P.S. Dodaj jeszcze że Jezus był Żydem, kompletnie nas dobijesz:)",[],1271586953557917696,HenrykTalar,Pan Pas Ratunkowy #BabiesLivesMatter,https://twitter.com/HenrykTalar/status/1474654380146282498,[],[],17,2,0,Żydem,"[{'screen_name': 'Piotr_Drac', 'name': 'Piotr Drac', 'id': '1225174370810724354'}]",19,2021-12-25
1464660225110257666,1464660225110257666,2021-11-27 19:19:44,"Chodzą pogłoski, że sprawa imigrantów to cel NATO. Chcą podstawić wojska pod granice  by obronić się przed Rosją gdy Żydki zaatakują Iran. Stąd black out żeby świat nie kontaktował się. Zobaczcie jak usunięto filmiki gdy mordowali palestynczykow.",[],2367420278,elina2349,ŚMIERĆ WROGOM POLSKI! tu jest Polska a nie Polin!,https://twitter.com/elina2349/status/1464660225110257666,[],[],60,7,22,Żydki,[],89,2021-11-27
