id,conversation_id,date,tweet,hashtags,user_id_str,username,name,link,urls,photos,nlikes,nreplies,nretweets,search,reply_to,score,date-day
1465734074878894083,1465734074878894083,2021-11-30 18:26:50,"Poniżej drukujemy tekst, który ukazał się 14 października w największej szwedzkiej gazecie Dagens Nyheter. List ten jest reakcją na wystąpienie ministra kultury Piotra Glińskiego na Międzynarodowym Forum Pamięci o Holokauście 1/3   https://t.co/72CyRIbJqY",[],811231947984924672,Jewish_pl,Jewish.pl,https://twitter.com/Jewish_pl/status/1465734074878894083,['https://jewish.pl/pl/2021/11/30/na-forum-w-malmo-nie-powinno-byc-miejsca-dla-ministra-glinskiego/'],[],2,6,1,holokauście,[],9,2021-11-30
1481234193401135104,1481232288851578881,2022-01-12 12:58:46,"@CezaryGraf Pewny jestes, ze wiesz co piszesz? Niemcy wiedzieli o Holokauscie? Trzeba precyzować mysli by nie wyjsc na idiotę w takich kwestiach.",[],163074267,polanskey,polansky,https://twitter.com/polanskey/status/1481234193401135104,[],[],5,4,0,holokauście,"[{'screen_name': 'CezaryGraf', 'name': 'Cezary Graf', 'id': '3460244835'}]",9,2022-01-12
1471119005536632842,1471049548088987650,2021-12-15 15:04:37,"@AM_Zukowska @Int_Wydarzenia nie Ty, rozegzaltowana ekscentryczko będziesz decydować na co można być wrażliwym, a na co nie. Na strajku kopiet wolno było krzyczeć o holokauście kobiet, nie? Na szczęscie nie macie patentu na moralność w tym kraju.",[],1139489075470188545,rottenschwanz,Żegota Rottenschwanz,https://twitter.com/rottenschwanz/status/1471119005536632842,[],[],7,1,0,holokauście,"[{'screen_name': 'AM_Zukowska', 'name': 'Anna-Maria Żukowska 💁🏻\u200d♀️ #Lewica ↙️↙️↙️🏳️\u200d🌈☮️', 'id': '941899796'}, {'screen_name': 'Int_Wydarzenia', 'name': 'Interia', 'id': '39480709'}]",8,2021-12-15
1466387444555825162,1466373156738899976,2021-12-02 13:43:05,"@JachiraKlaudia Proponuję zatem przyjąć narrację obozu kaczyńskiego, który będąc dziś w opozycji grzmiałby codziennie we wszystkich mediach o ""covidowym holokauście"" i ""eksterminacji narodu polskiego przez nieudolny rząd"".",[],2349871166,pangrochu,Bartek Grochulski,https://twitter.com/pangrochu/status/1466387444555825162,[],[],6,0,2,holokauście,"[{'screen_name': 'JachiraKlaudia', 'name': 'Klaudia Jachira', 'id': '3380008071'}]",8,2021-12-02
1463805982811824129,1463781870777294858,2021-11-25 10:45:17,"@zenonBk Hitler, chciałbym go spytać czy wiedział o holokauście.",[],1149033612,HoliBuntu,Mateusz Cholewiński,https://twitter.com/HoliBuntu/status/1463805982811824129,[],[],8,0,0,holokauście,"[{'screen_name': 'zenonBk', 'name': 'Zenon Błaszczyk', 'id': '2549512212'}]",8,2021-11-25
1481660770165440515,1481660770165440515,2022-01-13 17:13:50,"Europa, 80 lat po Holokauście. 🤦🏻‍♂️",[],112302365,FortArt,Artur Fortuna,https://twitter.com/FortArt/status/1481660770165440515,[],[],6,2,0,holokauście,[],8,2022-01-13
1475499670264856578,1475426955507998726,2021-12-27 17:11:49,"@Grayna19903220 @prezydentpl @AndrzejDuda ""Ameryka"" to została wymordowana w Holokauscie a rządzą prapra wnuki tych co tego dokonali a teraz przejmują Polin w swoje posiadanie!  Pozdrawiam serdecznie z pozdrowieniami dla Patronki Twojej !",[],924757898839851009,KrzysztofGrzeg7,Krzysztof Grzegorz,https://twitter.com/KrzysztofGrzeg7/status/1475499670264856578,[],[],6,1,0,holokauście,"[{'screen_name': 'Grayna19903220', 'name': 'Grażyna', 'id': '1377342018079363072'}, {'screen_name': 'prezydentpl', 'name': 'Kancelaria Prezydenta', 'id': '43932737'}, {'screen_name': 'AndrzejDuda', 'name': 'Andrzej Duda', 'id': '202086424'}]",7,2021-12-27
1471220309210583050,1471148856213704708,2021-12-15 21:47:10,"@fankowala @mietczynski chcesz bredzić o holokauście szczepionkami to proszę bardzo, ale nikt nie ma obowiązku tego czytać czy słuchać.",[],736696982320885760,Jonaszkostrzewa,Jonasz Kostrzewa,https://twitter.com/Jonaszkostrzewa/status/1471220309210583050,[],[],6,1,0,holokauście,"[{'screen_name': 'fankowala', 'name': 'fankowala', 'id': '1118531955182776321'}, {'screen_name': 'mietczynski', 'name': 'pewnie jerzy', 'id': '922155116'}]",7,2021-12-15
1464134720195907585,1464127856011796508,2021-11-26 08:31:34,"@ewa_j_m Zapewne to burzy mu narrację o powszechnym antysemityzmie Polaków, który w czasie II WŚ przejawiał się uczestnictwem w Holokauscie,  szmalcownictwem, w najlepszym razie wrogą biernością. Dla heroicznych Polaków nie ma miejsca w jego bajce.",[],538361074,pawcio_k,szyfrant Czerwonka,https://twitter.com/pawcio_k/status/1464134720195907585,[],[],7,0,0,holokauście,"[{'screen_name': 'ewa_j_m', 'name': 'EwaJ.', 'id': '951557483847352326'}]",7,2021-11-26
1469069309578301446,1469064680308150281,2021-12-09 23:19:52,@MBalawelder O to chodziło w holokauście - o odcięcie swojej biedoty.  Część bogaczy  dała dyla do USA  a cześć uciekła do Palestyny - reszty się pozbyli rękami Niemiec,[],1251123003431272449,HPoirot20,H_Poirot,https://twitter.com/HPoirot20/status/1469069309578301446,[],[],4,1,2,holokauście,"[{'screen_name': 'MBalawelder', 'name': 'Wczesny system ostrzegania filosceptic', 'id': '1020384619'}]",7,2021-12-09
1469448797227040774,1469448797227040774,2021-12-11 00:27:48,"Raport Jana Karskiego o Holokauście miał wstrząsnąć politykami 10 grudnia 1942 roku Edward Raczyński przedstawił aliantom szczegółowy raport o Holokauście, sporządzony na podstawie dokumentów przywiezionych do Londynu przez Jana Karskiego.   https://t.co/6lEbPgbVtA",[],864554093825675265,PolskieSluzby,Polskie_Sluzby,https://twitter.com/PolskieSluzby/status/1469448797227040774,"['https://www.polskieradio24.pl/39/156/Artykul/2635774,Raport-Jana-Karskiego-o-Holokauscie-mial-wstrzasnac-politykami']",[],4,0,3,holokauście,[],7,2021-12-11
1472216109919186949,1472188778232135683,2021-12-18 15:44:07,@KonradPiasecki Nie wierzę własnym oczom!!!  O czym chce Pan debatować z Dziamborem - o Holokauscie?!,[],1241128854594498565,Lllama_B,Beata zazwyczaj urocza,https://twitter.com/Lllama_B/status/1472216109919186949,[],[],6,1,0,holokauście,"[{'screen_name': 'KonradPiasecki', 'name': 'Konrad_Piasecki', 'id': '69513730'}]",7,2021-12-18
1471056689793228802,1470882150698336256,2021-12-15 10:57:00,"@jakubwiech Byłem, widziałem. Znałem ludzi co przeżyli to piekło. Te niecałe 100 lat temu też sobie mieszkańcy Niemiec racjonalizowali, że środki podjęte wobec pewnych mniejszości są potrzebne i nie ma w tym nic zlego, a później nawet wypierali wieści o holokauście. Zupełnie jak teraz TY",[],1288178165043658754,Lechita966,Lechita,https://twitter.com/Lechita966/status/1471056689793228802,[],[],7,0,0,holokauście,"[{'screen_name': 'jakubwiech', 'name': 'Jakub Wiech', 'id': '1682783586'}]",7,2021-12-15
1480107595629273091,1479911592900898821,2022-01-09 10:22:04,"@mc_mmcckk Na tym przykładzie można zrozumieć dlaczego ""fajnopolactwo"" przypisuje Polsce udział w holokauście, oni po prostu nie potrafią sobie wyobrazić, że można kogoś niepodpiepszyć, że o pomocy i ukrywaniu nie wspomnę.",[],3795515237,AZajst,Andrzej Zajst,https://twitter.com/AZajst/status/1480107595629273091,[],[],6,0,0,holokauście,"[{'screen_name': 'mc_mmcckk', 'name': 'McMurphy', 'id': '819177381244076033'}]",6,2022-01-09
1463189945275846659,1463185263157465093,2021-11-23 17:57:22,"@AnitaSchelde @MorawieckiM @ZiobroPL @Maciej_Swirski @PK_GOV_PL Szanowny Premierze i Panie ,Panowie ministrowie żądamy kategorycznie reakcji z waszej strony jako rząd Polski .Kłamstwa o Holokauście przez @jgrabows i innych kłamców . Jest to klamstwo historyczne ! @MorawieckiM @Kaminski_M_ @RauZbigniew @BeataSzydlo  @PremierRP @prezydentpl",[],3315625251,mdzearth,Ojczyzna 🇵🇱✌,https://twitter.com/mdzearth/status/1463189945275846659,[],[],3,0,3,holokauście,"[{'screen_name': 'AnitaSchelde', 'name': 'Kasjopea', 'id': '3816885381'}, {'screen_name': 'MorawieckiM', 'name': 'Mateusz Morawiecki', 'id': '939053934232195072'}, {'screen_name': 'ZiobroPL', 'name': 'Zbigniew Ziobro | SP', 'id': '1614572052'}, {'screen_name': 'Maciej_Swirski', 'name': 'Maciej Świrski', 'id': '315977058'}, {'screen_name': 'PK_GOV_PL', 'name': 'PROKURATURA', 'id': '882099974'}]",6,2021-11-23
1463525442179248133,1463525442179248133,2021-11-24 16:10:31,"EUROposłowie  wykrzyczcie o holokauście na morzu. Zginęło dotychczas blisko 100 000 migrantów.Najw tragedia wydarzyła się w 2013 r., kiedy u wybrzeży wyspy zatonęła łódź płynąca z Libii. W katastrofie zginęło ponad 360 nieleg migrantów z Erytrei, Somalii i Ghany.Wina Niemiec i UE",[],1430502496984870918,Micha22914045,Michał,https://twitter.com/Micha22914045/status/1463525442179248133,[],[],4,0,2,holokauście,[],6,2021-11-24
1470352722662764546,1470262278100598789,2021-12-13 12:19:41,"@Oltom154 Zginęli w holokauście, a w ponad rok po zakończeniu wojny 17.X.1946 cudownie z ducha został zrodzony ... TĘPY KRYPTO KOMUCH",[],356260682,Waspbee12,WASP,https://twitter.com/Waspbee12/status/1470352722662764546,[],[],6,0,0,holokauście,"[{'screen_name': 'Oltom154', 'name': 'Tomasz Olszewski 🇵🇱🇭🇺', 'id': '2420240818'}]",6,2021-12-13
1466129082169573382,1466129082169573382,2021-12-01 20:36:27,Panie @prezydentpl w nawiązaniu do obchodów Hanuki w pałacu prezydenta RP chciałbym zapytać. 1. Czy Żyd który opluł ambasadora Polski został ukarany? 2. Czy niejaki Lapid przeprosił za kłamstwa wygłaszane wobec Polski? 3. Czy polski ambasador powrócił do Izraela?,[],3537549496,jakubiak_marek,Marek Jakubiak💯🇵🇱,https://twitter.com/jakubiak_marek/status/1466129082169573382,[],[],1709,169,447,Żyd,[],2325,2021-12-01
1473968904594677766,1473968904594677766,2021-12-23 11:49:06,Uczciwy polski Żyd o Polsce:  https://t.co/EeWbNg1QQQ,[],4777754655,KsKneblewski,Ks Roman Kneblewski,https://twitter.com/KsKneblewski/status/1473968904594677766,[],['https://pbs.twimg.com/media/FHSWopBWUAYf5mz.jpg'],1509,32,515,Żyd,[],2056,2021-12-23
1478104651148967941,1478104651148967941,2022-01-03 21:43:05,"Przychodzi Żyd do Rabina i pyta się: - Rebe, szczepić się czy nie szczepić? - Ależ oczywiście, że się szczepić. To konieczne - odpowiada Rabin - Ale Rebe, przecież ty się nie zaszczepiłeś? - No ale ja się nikogo nie pytałem.",[],1419307049997983747,JarekPapis,Jarek PAPIS-ROZENBAUM,https://twitter.com/JarekPapis/status/1478104651148967941,[],[],1538,24,284,Żyd,[],1846,2022-01-03
1467182697353203720,1467182697353203720,2021-12-04 18:23:08,"Ale jaja, ale jaja, ale jaja... Żyd sam zrobił antysemityzm, żeby było na Polaków, ale zapomniał że jest monitoring. Hahaha  https://t.co/KOnmEGUbRz",[],3303937005,johnsmiths74,Rambo 2,https://twitter.com/johnsmiths74/status/1467182697353203720,['https://dorzeczy.pl/kraj/234874/antysemicki-wyskok-dzielem-dyrektora-jewish-community-center.html'],[],1001,97,483,Żyd,[],1581,2021-12-04
1474050903506403329,1474050903506403329,2021-12-23 17:14:56,"Jutro święty dzień szabatu i jak każdego roku, jako Żyd, jako religijny Żyd, życzę moim rodakom-współobywatelom Wesołych Świąt Bożego Narodzenia. Nie ""Wesołych Świąt"", ale Wesołych Świąt Bożego Narodzenia.",[],1419307049997983747,JarekPapis,Jarek PAPIS-ROZENBAUM,https://twitter.com/JarekPapis/status/1474050903506403329,[],[],943,70,121,Żyd,[],1134,2021-12-23
1463255845681213440,1463255845681213440,2021-11-23 22:19:14,"Jasiu @jgrabows opowiedz Nam jak : w 1943r. żydowski szmalcownik wydał twojego Dziadziusia na śmierć...a kiedy wylądował na al.Szucha...to zwolnił go kumpel z ""Gestapo""😃. A z pokoju tego gestapowca...SS-Untersturmfuhrera Karla Georga Brandta...żaden inny Żyd ŻYWY nie wyszedł.  https://t.co/3SlKI4997m",[],3816885381,AnitaSchelde,Kasjopea,https://twitter.com/AnitaSchelde/status/1463255845681213440,[],['https://pbs.twimg.com/media/FE6GX6YXsAYERuY.jpg'],716,14,324,Żyd,[],1054,2021-11-23
1470073381810847747,1470073381810847747,2021-12-12 17:49:41,Od kilku dni twitter huczy od eventu na którym pewien Żyd wycałował komunistycznego zbrodniarza...a nikt nie przypomniał człowieka który temu zbrodniarzowi próbował wymierzyć SPRAWIEDLIWOŚĆ. Dziwny jest ten świat 😔...  Śp.Stanisław Helski.Wieczna Chwała Bohaterom !  https://t.co/YzQ27Xl0WS,[],3816885381,AnitaSchelde,Kasjopea,https://twitter.com/AnitaSchelde/status/1470073381810847747,[],['https://pbs.twimg.com/media/FGa_3FEXwAIK-ME.jpg'],610,12,224,Żyd,[],846,2021-12-12
1480912009243860993,1480912009243860993,2022-01-11 15:38:31,"Wykopowe spierdony na tropie spisku: jestem Żydem, bo seplenię, a jakiś Żyd też seplenił.  https://t.co/RBBreIeypl",[],1313873922501246977,KorolukM,Koroluk,https://twitter.com/KorolukM/status/1480912009243860993,[],['https://pbs.twimg.com/media/FI1BeHYXIAMvrF1.png'],695,28,7,Żyd,[],730,2022-01-11
1470820743780966401,1470820743780966401,2021-12-14 19:19:26,Agato Diduszko @agatadiduszko  Żaden Żyd w Ameryce czy Francji nie mógł nawet marzyć o wysłaniu swych dzieci do podobnych szkół jak w Polsce. W żadnym innym kraju Żydzi nie czuli się tak bezpiecznie jak w Polsce. Na zdj.kolejka Żydów przed Konsulatem Polskim...Wiedeń 1938r. 😃.  https://t.co/OoduVY80sY,[],3816885381,AnitaSchelde,Kasjopea,https://twitter.com/AnitaSchelde/status/1470820743780966401,[],['https://pbs.twimg.com/media/FGlnoHUWUBAGTN5.jpg'],364,7,155,Żyd,[],526,2021-12-14
1478775337031020550,1478775337031020550,2022-01-05 18:08:09,"Na śmierć Polskiego Bohatera wydał ZWYRODNIAŁY Żyd prok.Beniamin Wajsblech syn Hersza...ten sam ZBRODNIARZ który przesłuchiwał i krzyczał ""śmierć...ŚMIERĆ !"" dla szefa KEDYW-u Śp.gen.Augusta Emila Fieldorfa ps.„Nil”. #WyklętaPamięć #האמתמפולין","['wyklętapamięć', 'האמתמפולין']",3816885381,AnitaSchelde,Kasjopea,https://twitter.com/AnitaSchelde/status/1478775337031020550,[],[],340,6,179,Żyd,[],525,2022-01-05
1472290874407149576,1472290874407149576,2021-12-18 20:41:12,"""Śledztwo"" Polskiej Joanny d’Arc...Śp.Ireny Odrzywołek prowadził ZWYRODNIAŁY Żyd kpt.UB Markus Kac. Oskarżał ZWYRODNIAŁY Żyd prok.Marek Szauber PAMIĘTAMY wasze ZBRODNIE ! #WyklętaPamięć #האמתמפולין  https://t.co/QPVDstpO1L","['wyklętapamięć', 'האמתמפולין']",3816885381,AnitaSchelde,Kasjopea,https://twitter.com/AnitaSchelde/status/1472290874407149576,[],['https://pbs.twimg.com/media/FG6Z2kNWYAM3krQ.jpg'],336,11,158,Żyd,[],505,2021-12-18
1464557305849077761,1464557305849077761,2021-11-27 12:30:46,"27 XI 1948 UB morduje we Wrocławiu Śp.Władysława Ciska ps.""Rom""-szefa kontrwywiadu Zarządu Okręgu Dolnośląskiego WiN,asystenta na PWr. Przed Męczeńską Śmiercią,tortury koordynuje ZWYRODNIAŁY Żyd F.Rosenbaum. Oskarża ZWYRODNIAŁY Żyd J.Unterweiser  #WyklętaPamięć  #האמתמפולין  https://t.co/5FQVxflWpE","['wyklętapamięć', 'האמתמפולין']",3816885381,AnitaSchelde,Kasjopea,https://twitter.com/AnitaSchelde/status/1464557305849077761,[],['https://pbs.twimg.com/media/FFMnDZ9WQAAimx-.jpg'],311,7,153,Żyd,[],471,2021-11-27
1480086943345958913,1480086943345958913,2022-01-09 09:00:00,9 stycznia 1942 | W Amsterdamie urodził się holenderski Żyd Jacob de Mesquita.   Do #Auschwitz dotarł 18 października 1942 r. w transporcie 1710 Żydów. Został zamordowany po selekcji w komorze gazowej.  https://t.co/uhVoJNjbWS,['auschwitz'],1239961987154575360,MuzeumAuschwitz,Muzeum Auschwitz,https://twitter.com/MuzeumAuschwitz/status/1480086943345958913,[],['https://pbs.twimg.com/media/ErOeVCEXMAAMDUE.jpg'],373,34,63,Żyd,[],470,2022-01-09
1477338835382157318,1477338835382157318,2022-01-01 19:00:00,1 stycznia 1939 | W Paryżu urodził się francuski Żyd Leon Guterman.   Do #Auschwitz dotarł 20 sierpnia 1942 r. w transporcie 1000 Żydów deportowanych z #Drancy. Po selekcji zamordowany w komorze gazowej.  https://t.co/EaqmDRBXgr,"['auschwitz', 'drancy']",1239961987154575360,MuzeumAuschwitz,Muzeum Auschwitz,https://twitter.com/MuzeumAuschwitz/status/1477338835382157318,[],['https://pbs.twimg.com/media/FH75znVXoBUQTJo.jpg'],325,23,59,Żyd,[],407,2022-01-01
1471116341214167042,1471115483780980736,2021-12-15 14:54:02,"ta sama osoba krzyczy don’t call me murz*n bo kolor skory mnie nie definiuje jednocześnie mówiąc wyglądam jak żyd bo z włosów wystaje jej na zdjęciu loczek z boku, a na zdjeciu gdzie ma przerysowane brwi mówi ze wyglada jak prostytutka, to jest dość stygmatyzujące",[],1199737627903176709,zdrobnienia,anja,https://twitter.com/zdrobnienia/status/1471116341214167042,[],[],380,0,8,Żyd,[],388,2021-12-15
1477614034123902976,1477614034123902976,2022-01-02 13:13:33,"Szok!  Śpiewak: Zgadzam się, że za takie zachowanie wobec imigrantów powinna być Norymberga 😡😡 Na te skandaliczne słowa, powinna zareagować Prokuratura. Żyd opluwający Polskę 😡😡😡  https://t.co/r0vcVmN9AS",[],1047050458970361857,Rene88859361,Rene Gross 🇵🇱🇳🇱🇪🇺❤️Jestem na Gab. i FB.,https://twitter.com/Rene88859361/status/1477614034123902976,[],['https://pbs.twimg.com/media/FIGJv7yX0Agfqiw.png'],237,30,83,Żyd,[],350,2022-01-02
1481536504623161347,1481536504623161347,2022-01-13 09:00:02,13 stycznia 1939 | W Amsterdamie urodził się holenderski Żyd Eric Polak.  W lutym 1944 r. został deportowany do #Auschwitz i zamordowany po selekcji w komorze gazowej.  https://t.co/Kx88ffNrup,['auschwitz'],1239961987154575360,MuzeumAuschwitz,Muzeum Auschwitz,https://twitter.com/MuzeumAuschwitz/status/1481536504623161347,[],['https://pbs.twimg.com/media/ErjHqrjXcA8GGZ5.jpg'],285,26,38,Żyd,[],349,2022-01-13
1466829626752348162,1466829626752348162,2021-12-03 19:00:10,"Ale jak przypomnę sobie, że Juda powiedział, że tu jest Polin a nie Polska, to ciągle wkurw mnie bierze, i powtarzam sobie, że za całym złem świata stoi żyd.",[],1245039096390733824,MartaStruczews1,Narodowa Marta,https://twitter.com/MartaStruczews1/status/1466829626752348162,[],[],258,38,49,Żyd,[],345,2021-12-03
1469349459129733134,1469349459129733134,2021-12-10 17:53:04,Shalom @IsraelinPoland &amp; @polinmuseum &amp; @jgrabows &amp; @Michal_Bilewicz ! Chciałam zapytać : czy często się zdarza aby Żyd (Adam Szechter) kochał zoologicznego antysemitę (Wojciech Jaruzelski) 🤔 ???,[],3816885381,AnitaSchelde,Kasjopea,https://twitter.com/AnitaSchelde/status/1469349459129733134,[],[],229,14,94,Żyd,[],337,2021-12-10
1480778314159640577,1480778314159640577,2022-01-11 06:47:16,Czeski Żyd Kvido (Quido) Hirsch.  Pochodził z Pragi. Zginął w #Auschwitz 11 stycznia 1943 roku.  Miał 16 lat.  https://t.co/7NqvqHWbub,['auschwitz'],1239961987154575360,MuzeumAuschwitz,Muzeum Auschwitz,https://twitter.com/MuzeumAuschwitz/status/1480778314159640577,[],['https://pbs.twimg.com/media/FIzIBCdXMAEBZap.jpg'],254,7,23,Żyd,[],284,2022-01-11
1475006303504420872,1475006303504420872,2021-12-26 08:31:21,Polski Żyd Chaim Kleinman.  Pochodził z Nowego Sącza. Zginął w niemieckim nazistowskim obozie #Auschwitz 26 grudnia 1941 r. po 2 tygodniach uwięzienia. Miał 59 lat.  https://t.co/WL3Hw2SZGb,['auschwitz'],1239961987154575360,MuzeumAuschwitz,Muzeum Auschwitz,https://twitter.com/MuzeumAuschwitz/status/1475006303504420872,[],['https://pbs.twimg.com/media/FHhGabFWYAEg1EV.jpg'],236,8,36,Żyd,[],280,2021-12-26
1477565325990236160,1477565325990236160,2022-01-02 10:00:00,2 stycznia 1940 | W Będzinie urodził się polski Żyd Aleksander Kleinman.   Deportowany z getta w Będzinie do #Auschwitz w lecie 1942 lub 1943 r. Został zabity w komorze gazowej w Auschwitz II-Birkenau.  https://t.co/2XU2fpF8Hm,['auschwitz'],1239961987154575360,MuzeumAuschwitz,Muzeum Auschwitz,https://twitter.com/MuzeumAuschwitz/status/1477565325990236160,[],['https://pbs.twimg.com/media/EqqZs0yW8AAVP65.jpg'],218,13,42,Żyd,[],273,2022-01-02
1480072569541771266,1480072569541771266,2022-01-09 08:02:53,Polski Żyd Menache Kalman.   Zginął w niemieckim obozie #Auschwitz 9 stycznia 1942 roku. Miał 18 lat.  https://t.co/HBvcAqwyDI,['auschwitz'],1239961987154575360,MuzeumAuschwitz,Muzeum Auschwitz,https://twitter.com/MuzeumAuschwitz/status/1480072569541771266,[],['https://pbs.twimg.com/media/FIpGJ4XXoAQp6mc.jpg'],240,6,26,Żyd,[],272,2022-01-09
1480911528803147784,1480911528803147784,2022-01-11 15:36:37,"ANEKS nr 1 Jednym ze skazanych na śmierć razem ze Śp.Aleksandrem Życińskim był Śp.Karol Łoniewski ""Lew""...podczas okupacji niemieckiej RATUJĄCY Żydów. Na śmierć Polskich Bohaterów wydaje...Żyd...Stanisław Zilberman. Czyli jakaś nieludzka,zdegenerowana forma ""wdzięczności""...",[],3816885381,AnitaSchelde,Kasjopea,https://twitter.com/AnitaSchelde/status/1480911528803147784,[],[],177,1,90,Żyd,[],268,2022-01-11
1470045781658939396,1470045781658939396,2021-12-12 16:00:01,12 grudnia 1925 | W Pradze urodził się czeski Żyd Harry Liebermann.  Deportowany do #Auschwitz z getta w #Theresienstadt 28 września 1944 r.  Zginął w Dachau 24 stycznia 1945 r.  https://t.co/CwlpYUKUtA,"['auschwitz', 'theresienstadt']",1239961987154575360,MuzeumAuschwitz,Muzeum Auschwitz,https://twitter.com/MuzeumAuschwitz/status/1470045781658939396,[],['https://pbs.twimg.com/media/FGY0sFaXwAo12Zc.jpg'],213,13,41,Żyd,[],267,2021-12-12
1467410501630058498,1467410501630058498,2021-12-05 09:28:21,"Kiedyś ""Żyd"", ""kułak"", ""reakcjonista"", a teraz ""antyszczepionkowiec"".  Zawsze złym ludziom jakiś wróg ludu jest potrzebny.",[],1250804435275710465,Ankapitalizm,Anarchokapitalizm,https://twitter.com/Ankapitalizm/status/1467410501630058498,[],[],221,11,13,Żyd,[],245,2021-12-05
1467811052733747203,1467811052733747203,2021-12-06 12:00:00,6 grudnia 1937 | W Borculo urodził się holenderski Żyd Sallo de Vries.  Deportowany do #Auschwitz w październiku 1942 r. Po selekcji zamordowany w komorze gazowej.  https://t.co/pmEsiKeaWs,['auschwitz'],1239961987154575360,MuzeumAuschwitz,Muzeum Auschwitz,https://twitter.com/MuzeumAuschwitz/status/1467811052733747203,[],['https://pbs.twimg.com/media/FF3tJPDXIAULe8S.jpg'],202,9,33,Żyd,[],244,2021-12-06
1478425997221318656,1478425997221318656,2022-01-04 19:00:00,4 stycznia 1924 | W Miszkolcu urodził się węgierski Żyd Zoltan Junger. Stolarz.   W 1944 r. został deportowany do #Auschwitz. Nie przeżył.  https://t.co/GykQN86kpy,['auschwitz'],1239961987154575360,MuzeumAuschwitz,Muzeum Auschwitz,https://twitter.com/MuzeumAuschwitz/status/1478425997221318656,[],['https://pbs.twimg.com/media/Eq0cploXIAcV97M.jpg'],208,10,25,Żyd,[],243,2022-01-04
1478033414381002755,1478033414381002755,2022-01-03 17:00:01,3 stycznia 1900 | W Rzymie urodził się włoski Żyd Emanuele Di Porto. Kupiec.   W 1944 r. został deportowany do #Auschwitz. Nie przeżył.  https://t.co/hID04KhiIZ,['auschwitz'],1239961987154575360,MuzeumAuschwitz,Muzeum Auschwitz,https://twitter.com/MuzeumAuschwitz/status/1478033414381002755,[],['https://pbs.twimg.com/media/EqvhMJxXMAAXgmo.jpg'],210,8,16,Żyd,[],234,2022-01-03
1463001455816855552,1463001455816855552,2021-11-23 05:28:22,22 listopada 1936 | W Amsterdamie urodził się holenderski Żyd Thomas Pfeffer.  W lutym 1944 r. przeniesiony z #Westerbork do getta w #Theresienstadt. 28 maja 1944 r. deportowany do #Auschwitz i zarejestrowany w obozie rodzinnym dla Żydów z Theresienstadt w Birkenau. Nie przeżył.  https://t.co/3ODTArCrnz,"['westerbork', 'theresienstadt', 'auschwitz']",1239961987154575360,MuzeumAuschwitz,Muzeum Auschwitz,https://twitter.com/MuzeumAuschwitz/status/1463001455816855552,[],['https://pbs.twimg.com/media/FE2f83sWYAArLTN.jpg'],194,7,31,Żyd,[],232,2021-11-23
1463477506225229826,1463477506225229826,2021-11-24 13:00:02,24 listopada 1939 | W Enschede urodził się holenderski Żyd Alex Weijel.   W październiku 1942 r. Został deportowany do #Auschwitz i po selekcji zamordowany w komorze gazowej.  https://t.co/EqYRiKwFyZ,['auschwitz'],1239961987154575360,MuzeumAuschwitz,Muzeum Auschwitz,https://twitter.com/MuzeumAuschwitz/status/1463477506225229826,[],['https://pbs.twimg.com/media/FE4REVzWQAEUXL8.jpg'],182,17,32,Żyd,[],231,2021-11-24
1481581792633057281,1481581792633057281,2022-01-13 12:00:00,13 stycznia 1936 | W Wiedniu urodził się austriacki Żyd George Peter Liebross.   Deportowany do #Auschwitz i zamordowany w komorze gazowej  https://t.co/hhVbjvu8uX,['auschwitz'],1239961987154575360,MuzeumAuschwitz,Muzeum Auschwitz,https://twitter.com/MuzeumAuschwitz/status/1481581792633057281,[],['https://pbs.twimg.com/media/ErjHKfQXAAUd1Q8.jpg'],194,7,29,Żyd,[],230,2022-01-13
1479045077892796423,1479045077892796423,2022-01-06 12:00:00,6 stycznia 1930 | W Náchodzie urodził się czeski Żyd Petr Beck. Syn Karela i Zdeny.  Deportowany do #Auschwitz z getta #Theresienstadt 28 października 1944 r. Nie przeżył.  https://t.co/A0jPPPSnvD,"['auschwitz', 'theresienstadt']",1239961987154575360,MuzeumAuschwitz,Muzeum Auschwitz,https://twitter.com/MuzeumAuschwitz/status/1479045077892796423,[],['https://pbs.twimg.com/media/Eq_Fz3UXUAAbgFD.jpg'],181,8,36,Żyd,[],225,2022-01-06
1467740079686918144,1467740079686918144,2021-12-06 07:17:58,"Czeski Żyd Ernst Kraus.  Był robotnikiem kolejowym z Brna. Zginął w niemieckim nazistowskim obozie #Auschwitz 6 grudnia 1941 roku, po 15 dniach. Miał 25 lat.  https://t.co/UKI4dSusLl",['auschwitz'],1239961987154575360,MuzeumAuschwitz,Muzeum Auschwitz,https://twitter.com/MuzeumAuschwitz/status/1467740079686918144,[],['https://pbs.twimg.com/media/FF51ufQX0AAaTFZ.jpg'],174,7,37,Żyd,[],218,2021-12-06
1472099430878875648,1472099430878875648,2021-12-18 08:00:29,Polski Żyd Juda Gutwein z Nowego Sącza.  Zginął w niemieckim obozie #Auschwitz 18 grudnia 1941 r. po 6 dniach uwięzienia. Miał 55 lat.  https://t.co/Ve2ZgeETQK,['auschwitz'],1239961987154575360,MuzeumAuschwitz,Muzeum Auschwitz,https://twitter.com/MuzeumAuschwitz/status/1472099430878875648,[],['https://pbs.twimg.com/media/FG3ynybXIAQ23bL.jpg'],189,5,23,Żyd,[],217,2021-12-18
